{
  "id": "constant",
  "version": 1,
  "source": "static",
  "description": "Configuration B: fixed record size and fixed slot rate, no idle state",
  "floor_slot_ms": 500,
  "start_state": "constant",
  "states": [
    {
      "name": "constant",
      "record_size": 1024,
      "slot_ms": 100,
      "duration_s": [3600, 86400]
    }
  ],
  "transitions": {
    "constant": {"constant": 1.0}
  }
}
